{
  "schemaVersion": 1,
  "campaignId": "campaign.vertical_slice.regional_crisis",
  "fingerprint": "1bc31247330a8bc0af7103aaa8b70b51d8cd5d7a",
  "events": [
    {
      "id": "event.foundry_shortage",
      "title": "Foundry Shortage",
      "assetPath": "/Game/DA/Events/E_FoundryShortage",
      "scope": "regional",
      "trigger": {"metric": "forgeweave.resource_hunger", "comparison": "greater_than", "threshold": 70},
      "warningDurationWorldTicks": 2,
      "initialStageId": "shortage_warning",
      "ignoredResolutionId": "collapse",
      "stages": [
        {"id": "shortage_warning", "durationWorldTicks": 2, "priceModifier": 0.20, "nextStageIds": ["market_spike", "industrial_support", "eden_restriction", "brokered_compact", "market_exploitation"]},
        {"id": "market_spike", "durationWorldTicks": 1, "priceModifier": 0.35, "nextStageIds": ["ecological_dispute", "industrial_support", "eden_restriction", "brokered_compact", "market_exploitation"]},
        {"id": "ecological_dispute", "durationWorldTicks": 1, "priceModifier": 0.35, "nextStageIds": ["emergency_overdrive", "industrial_support", "eden_restriction", "brokered_compact", "market_exploitation"]},
        {"id": "emergency_overdrive", "durationWorldTicks": 2, "priceModifier": 0.60, "nextStageIds": ["collapse", "industrial_support", "eden_restriction", "brokered_compact", "market_exploitation"]}
      ],
      "systems": ["market", "trade", "diplomacy", "ecology", "conquest"],
      "resolutions": [
        {
          "id": "industrial_support", "recoveryWorldTicks": 4, "marketModifier": 0.20,
          "tradeRouteCapacityDelta": 20, "ecologyDelta": -8,
          "relationshipId": "relationship.synara.eden", "relationshipMetric": "grievance", "relationshipDelta": 8,
          "resourceHungerDelta": -30, "historyTags": ["foundry_shortage_industrial_support"],
          "citizenOutcomes": {
            "citizen.neutral.tal_arden": "tal_forgeweave_pumps_installed",
            "citizen.forgeweave.mara_kest": "mara_component_supply_secured",
            "citizen.eden.ori_sen": "ori_watershed_warning_overruled"
          }
        },
        {
          "id": "eden_restriction", "recoveryWorldTicks": 4, "marketModifier": 0.20,
          "tradeRouteCapacityDelta": -10, "ecologyDelta": 12,
          "relationshipId": "relationship.synara.eden", "relationshipMetric": "trust", "relationshipDelta": 10,
          "resourceHungerDelta": -10, "historyTags": ["foundry_shortage_eden_restriction"],
          "citizenOutcomes": {
            "citizen.neutral.tal_arden": "tal_eden_filtration_installed",
            "citizen.forgeweave.mara_kest": "mara_emergency_shift_constrained",
            "citizen.eden.ori_sen": "ori_watershed_boundary_protected"
          }
        },
        {
          "id": "brokered_compact", "recoveryWorldTicks": 6, "marketModifier": 0.20,
          "tradeRouteCapacityDelta": 10, "ecologyDelta": 5,
          "relationshipId": "relationship.synara.eden", "relationshipMetric": "compatibility", "relationshipDelta": 12,
          "resourceHungerDelta": -20, "historyTags": ["foundry_shortage_brokered_compact"],
          "citizenOutcomes": {
            "citizen.neutral.tal_arden": "tal_shared_reservoir_plan",
            "citizen.forgeweave.mara_kest": "mara_audited_transition",
            "citizen.eden.ori_sen": "ori_engineered_mitigation"
          }
        },
        {
          "id": "market_exploitation", "recoveryWorldTicks": 8, "marketModifier": 0.60,
          "tradeRouteCapacityDelta": 25, "ecologyDelta": -15,
          "relationshipId": "relationship.synara.eden", "relationshipMetric": "grievance", "relationshipDelta": 15,
          "resourceHungerDelta": 5, "historyTags": ["foundry_shortage_market_exploitation"],
          "citizenOutcomes": {
            "citizen.neutral.tal_arden": "tal_shortage_endured",
            "citizen.forgeweave.mara_kest": "mara_numbers_suppressed",
            "citizen.eden.ori_sen": "ori_warning_ignored"
          }
        },
        {
          "id": "collapse", "recoveryWorldTicks": 8, "marketModifier": 0.60,
          "tradeRouteCapacityDelta": -10, "ecologyDelta": -20,
          "relationshipId": "relationship.synara.eden", "relationshipMetric": "grievance", "relationshipDelta": 20,
          "resourceHungerDelta": 10, "historyTags": ["foundry_shortage_ignored", "foundry_shortage_collapse"],
          "citizenOutcomes": {
            "citizen.neutral.tal_arden": "tal_reservoir_failed",
            "citizen.forgeweave.mara_kest": "mara_empty_shift_recorded",
            "citizen.eden.ori_sen": "ori_watershed_damaged"
          }
        }
      ]
    },
    {
      "id": "event.grid_strain", "title": "Grid Strain", "assetPath": "/Game/DA/Events/E_GridStrain", "scope": "city",
      "trigger": {"metric": "city.power_reserve_percent", "comparison": "less_than", "threshold": 5}, "warningDurationWorldTicks": 3,
      "initialStageId": "grid_warning", "ignoredResolutionId": "blackout",
      "stages": [
        {"id": "grid_warning", "durationWorldTicks": 3, "priceModifier": 0, "nextStageIds": ["brownouts", "emergency_generation", "demand_reduction", "import_power", "prioritize_districts"]},
        {"id": "brownouts", "durationWorldTicks": 2, "priceModifier": 0, "nextStageIds": ["blackout", "emergency_generation", "demand_reduction", "import_power", "prioritize_districts"]}
      ], "systems": ["power", "dependency"], "resolutions": [
        {"id":"emergency_generation","recoveryWorldTicks":4,"marketModifier":0,"tradeRouteCapacityDelta":0,"ecologyDelta":-5,"relationshipId":"relationship.synara.eden","relationshipMetric":"grievance","relationshipDelta":2,"resourceHungerDelta":0,"historyTags":["grid_emergency_generation"],"citizenOutcomes":{}},
        {"id":"demand_reduction","recoveryWorldTicks":4,"marketModifier":0,"tradeRouteCapacityDelta":0,"ecologyDelta":2,"relationshipId":"relationship.synara.eden","relationshipMetric":"trust","relationshipDelta":1,"resourceHungerDelta":0,"historyTags":["grid_demand_reduction"],"citizenOutcomes":{}},
        {"id":"import_power","recoveryWorldTicks":4,"marketModifier":0,"tradeRouteCapacityDelta":-5,"ecologyDelta":0,"relationshipId":"relationship.synara.eden","relationshipMetric":"compatibility","relationshipDelta":2,"resourceHungerDelta":0,"historyTags":["grid_import_power"],"citizenOutcomes":{}},
        {"id":"prioritize_districts","recoveryWorldTicks":4,"marketModifier":0,"tradeRouteCapacityDelta":0,"ecologyDelta":0,"relationshipId":"relationship.synara.eden","relationshipMetric":"grievance","relationshipDelta":2,"resourceHungerDelta":0,"historyTags":["grid_prioritized_districts"],"citizenOutcomes":{}},
        {"id":"blackout","recoveryWorldTicks":6,"marketModifier":0,"tradeRouteCapacityDelta":-10,"ecologyDelta":-3,"relationshipId":"relationship.synara.eden","relationshipMetric":"grievance","relationshipDelta":6,"resourceHungerDelta":5,"historyTags":["grid_blackout"],"citizenOutcomes":{}}
      ]
    },
    {
      "id": "event.housing_surge", "title": "Housing Surge", "assetPath": "/Game/DA/Events/E_HousingSurge", "scope": "city",
      "trigger": {"metric": "city.attractiveness_and_vacancy", "comparison": "greater_than", "threshold": 75}, "warningDurationWorldTicks": 1,
      "initialStageId":"arrival_warning","ignoredResolutionId":"housing_crisis",
      "stages":[{"id":"arrival_warning","durationWorldTicks":1,"priceModifier":0,"nextStageIds":["vacancy_exhausted","emergency_housing","vertical_growth","restrict_intake","subsidize_housing"]},{"id":"vacancy_exhausted","durationWorldTicks":2,"priceModifier":0,"nextStageIds":["housing_crisis","emergency_housing","vertical_growth","restrict_intake","subsidize_housing"]}], "systems": ["housing", "migration"], "resolutions": [
        {"id":"emergency_housing","recoveryWorldTicks":4,"marketModifier":0,"tradeRouteCapacityDelta":0,"ecologyDelta":-3,"relationshipId":"relationship.synara.eden","relationshipMetric":"trust","relationshipDelta":1,"resourceHungerDelta":0,"historyTags":["housing_emergency_built"],"citizenOutcomes":{}},
        {"id":"vertical_growth","recoveryWorldTicks":4,"marketModifier":0,"tradeRouteCapacityDelta":0,"ecologyDelta":-1,"relationshipId":"relationship.synara.eden","relationshipMetric":"compatibility","relationshipDelta":1,"resourceHungerDelta":0,"historyTags":["housing_vertical_growth"],"citizenOutcomes":{}},
        {"id":"restrict_intake","recoveryWorldTicks":4,"marketModifier":0,"tradeRouteCapacityDelta":0,"ecologyDelta":1,"relationshipId":"relationship.synara.eden","relationshipMetric":"grievance","relationshipDelta":4,"resourceHungerDelta":0,"historyTags":["housing_intake_restricted"],"citizenOutcomes":{}},
        {"id":"subsidize_housing","recoveryWorldTicks":4,"marketModifier":0,"tradeRouteCapacityDelta":0,"ecologyDelta":0,"relationshipId":"relationship.synara.eden","relationshipMetric":"trust","relationshipDelta":2,"resourceHungerDelta":0,"historyTags":["housing_subsidized"],"citizenOutcomes":{}},
        {"id":"housing_crisis","recoveryWorldTicks":6,"marketModifier":0,"tradeRouteCapacityDelta":0,"ecologyDelta":-5,"relationshipId":"relationship.synara.eden","relationshipMetric":"grievance","relationshipDelta":8,"resourceHungerDelta":5,"historyTags":["housing_crisis_ignored"],"citizenOutcomes":{}}
      ]
    },
    {
      "id": "event.green_line", "title": "Green Line", "assetPath": "/Game/DA/Events/E_GreenLine", "scope": "regional",
      "trigger": {"metric": "eden.ecological_balance", "comparison": "less_than", "threshold": 70}, "warningDurationWorldTicks": 2,
      "initialStageId":"watershed_warning","ignoredResolutionId":"boundary_failure",